[
 {
  "finding_id": "F-01",
  "category": "exposure",
  "description": "Stored exposure equals the number of days in the period (values up to 365.0) for 114 training rows across the three policy tables (motor 47, buildings 33, contents 34); stored/date-derived ratio clusters at x365. Stored exposure for these rows summed to 35,703 against a true 97.8 exposure-years, i.e. they inflated total training exposure by 37% (motor 54,429 stored vs 38,969 derived).",
  "tables": [
   "policies_motor",
   "policies_buildings",
   "policies_contents"
  ],
  "row_count_estimate": 114,
  "applies_to_test": true,
  "action_taken": "REPAIR",
  "action_detail": "Exposure recomputed for EVERY policy and test row as (period_end - period_start + 1 day) / 365, rounded to 4 dp, which is the convention 99.5% of rows already follow (a 365-day row has exposure 1.0000; 1-day rows 0.0027). Rows in this cluster are flagged dq_exposure_class = 'day_count'. The same recomputation was run on the test files, where it is the identity (no test row deviates).",
  "rationale": "R-0001/R-0014: a ratio cluster at ~365 is a day count written into an exposure field. Date-derived exposure is the only trustworthy basis and is applied uniformly to training and test.",
  "triggered_by_rules": [
   "R-0001",
   "R-0014"
  ],
  "team_query": false,
  "affected_ids": {
   "id_type": "row_id",
   "ids": [
    "M00001778",
    "M00001779",
    "M00003782",
    "M00004018",
    "M00005039",
    "M00005268",
    "M00006219",
    "M00007069",
    "M00007772",
    "M00008435",
    "M00009188",
    "M00009293",
    "M00009492",
    "M00013054",
    "M00014160",
    "M00014345",
    "M00014673",
    "M00015265",
    "M00016207",
    "M00016301",
    "M00017745",
    "M00017986",
    "M00052013",
    "M00053193",
    "M00053198",
    "M00053236",
    "M00053395",
    "M00054483",
    "M00054515",
    "M00054962",
    "M00058050",
    "M00058791",
    "M00060196",
    "M00061177",
    "M00061659",
    "M00062052",
    "M00063242",
    "M00065628",
    "M00066144",
    "M00066258",
    "M00066279",
    "M00067195",
    "M00067741",
    "M00070610",
    "M00075437",
    "M00075462",
    "M00075470",
    "B00021843",
    "B00022243",
    "B00023861",
    "B00024251",
    "B00024710",
    "B00026250",
    "B00026832",
    "B00027448",
    "B00027468",
    "B00027679",
    "B00027710",
    "B00027726",
    "B00028716",
    "B00028836",
    "B00029146",
    "B00029390",
    "B00031618",
    "B00031855",
    "B00032008",
    "B00032805",
    "B00033537",
    "B00076329",
    "B00079236",
    "B00080216",
    "B00081691",
    "B00082921",
    "B00083186",
    "B00085424",
    "B00088101",
    "B00088140",
    "B00088650",
    "B00089821",
    "B00089884",
    "C00034268",
    "C00034319",
    "C00034695",
    "C00035302",
    "C00035962",
    "C00036945",
    "C00038175",
    "C00039813",
    "C00040086",
    "C00042734",
    "C00044031",
    "C00045438",
    "C00046777",
    "C00049451",
    "C00090998",
    "C00091782",
    "C00092600",
    "C00095032",
    "C00096232",
    "C00096258",
    "C00097825",
    "C00098654",
    "C00098972",
    "C00099277",
    "C00100495",
    "C00101993",
    "C00104293",
    "C00105426",
    "C00105762",
    "C00106552",
    "C00107699",
    "C00107775",
    "C00108504",
    "C00108880"
   ]
  }
 },
 {
  "finding_id": "F-02",
  "category": "exposure",
  "description": "A second, smaller convention inside the 'looks fine' range: 495 training rows (motor 207, buildings 122, contents 166) carry exposure = days / 360 (stored/derived ratio 1.0139 = 365/360), visible only as a spike in the ratio tabulation after the day-count cluster is removed. Effect is small (+1.4% on those rows, +0.3 exposure-years in total) but it is a different basis.",
  "tables": [
   "policies_motor",
   "policies_buildings",
   "policies_contents"
  ],
  "row_count_estimate": 495,
  "applies_to_test": true,
  "action_taken": "REPAIR",
  "action_detail": "Repaired by the same date-based recomputation as F-01; flagged dq_exposure_class = 'basis_360'. Residual stored/derived ratio after removing both clusters lies within 4-dp rounding (0.986-1.004, all on rows shorter than 60 days).",
  "rationale": "R-0014 (amended): re-tabulate the residual after the obvious cluster; a 360-day basis sits at 1.014 and is a convention error, not rounding.",
  "triggered_by_rules": [
   "R-0014"
  ],
  "team_query": false,
  "affected_ids": {
   "id_type": "row_id",
   "ids": [
    "M00000147",
    "M00000490",
    "M00000527",
    "M00000663",
    "M00000843",
    "M00000870",
    "M00001023",
    "M00001199",
    "M00001394",
    "M00001412",
    "M00001440",
    "M00001940",
    "M00001947",
    "M00002183",
    "M00002215",
    "M00002261",
    "M00002314",
    "M00002320",
    "M00002381",
    "M00002805",
    "M00003162",
    "M00003303",
    "M00003383",
    "M00003389",
    "M00003457",
    "M00003910",
    "M00004035",
    "M00004149",
    "M00004441",
    "M00004552",
    "M00004623",
    "M00004735",
    "M00004786",
    "M00004853",
    "M00004958",
    "M00005171",
    "M00005210",
    "M00005451",
    "M00005853",
    "M00005861",
    "M00006026",
    "M00006134",
    "M00006363",
    "M00006499",
    "M00006584",
    "M00007314",
    "M00007394",
    "M00008235",
    "M00008249",
    "M00008253",
    "M00008366",
    "M00008495",
    "M00008596",
    "M00009018",
    "M00009644",
    "M00009790",
    "M00009938",
    "M00010771",
    "M00010813",
    "M00010847",
    "M00011053",
    "M00011347",
    "M00011842",
    "M00011886",
    "M00012172",
    "M00012221",
    "M00012452",
    "M00012486",
    "M00012567",
    "M00012663",
    "M00013162",
    "M00013506",
    "M00013653",
    "M00013824",
    "M00014066",
    "M00014238",
    "M00014426",
    "M00014891",
    "M00015296",
    "M00015486",
    "M00015895",
    "M00015901",
    "M00016166",
    "M00016282",
    "M00016511",
    "M00016596",
    "M00016692",
    "M00016694",
    "M00017088",
    "M00017104",
    "M00017543",
    "M00017816",
    "M00018055",
    "M00018813",
    "M00019177",
    "M00019283",
    "M00019424",
    "M00019502",
    "M00019532",
    "M00019542",
    "M00019683",
    "M00020037",
    "M00020408",
    "M00020836",
    "M00021128",
    "M00021331",
    "M00021609",
    "M00050453",
    "M00050535",
    "M00051266",
    "M00051631",
    "M00051987",
    "M00052045",
    "M00052177",
    "M00052252",
    "M00052289",
    "M00052386",
    "M00052996",
    "M00053152",
    "M00053590",
    "M00053654",
    "M00053677",
    "M00053801",
    "M00053988",
    "M00054031",
    "M00054068",
    "M00054148",
    "M00054308",
    "M00054315",
    "M00055121",
    "M00055209",
    "M00055264",
    "M00055515",
    "M00055532",
    "M00055702",
    "M00056126",
    "M00056133",
    "M00056182",
    "M00056786",
    "M00057158",
    "M00057287",
    "M00057583",
    "M00058699",
    "M00059599",
    "M00059695",
    "M00059731",
    "M00059759",
    "M00059826",
    "M00060252",
    "M00060381",
    "M00060552",
    "M00060831",
    "M00060877",
    "M00061001",
    "M00061219",
    "M00061810",
    "M00062048",
    "M00062260",
    "M00062711",
    "M00062775",
    "M00062893",
    "M00062998",
    "M00063274",
    "M00063941",
    "M00064697",
    "M00065226",
    "M00065371",
    "M00065437",
    "M00065571",
    "M00065753",
    "M00066056",
    "M00066112",
    "M00066198",
    "M00066627",
    "M00067897",
    "M00067907",
    "M00068264",
    "M00068448",
    "M00068703",
    "M00068742",
    "M00068753",
    "M00068976",
    "M00069253",
    "M00070111",
    "M00070331",
    "M00070770",
    "M00070804",
    "M00070830",
    "M00071485",
    "M00071514",
    "M00071631",
    "M00071725",
    "M00072094",
    "M00072236",
    "M00072382",
    "M00073264",
    "M00073397",
    "M00073559",
    "M00073581",
    "M00073826",
    "M00074159",
    "M00074291",
    "M00074449",
    "M00074519",
    "M00074602",
    "M00075109",
    "M00075379",
    "B00022601",
    "B00022607",
    "B00022658",
    "B00022733",
    "B00022958",
    "B00023144",
    "B00023371",
    "B00023486",
    "B00024431",
    "B00024448",
    "B00024520",
    "B00024805",
    "B00024948",
    "B00024969",
    "B00025008",
    "B00025141",
    "B00025161",
    "B00025574",
    "B00026021",
    "B00026211",
    "B00026381",
    "B00026667",
    "B00026978",
    "B00027048",
    "B00027519",
    "B00027662",
    "B00027806",
    "B00027887",
    "B00028124",
    "B00028171",
    "B00028504",
    "B00028536",
    "B00029017",
    "B00029249",
    "B00029577",
    "B00029592",
    "B00029964",
    "B00030339",
    "B00030410",
    "B00030481",
    "B00030603",
    "B00030972",
    "B00031202",
    "B00031228",
    "B00031374",
    "B00031504",
    "B00031600",
    "B00032084",
    "B00032265",
    "B00032360",
    "B00032425",
    "B00032670",
    "B00032851",
    "B00033013",
    "B00033189",
    "B00033468",
    "B00033694",
    "B00033726",
    "B00033789",
    "B00033886",
    "B00034117",
    "B00076000",
    "B00076272",
    "B00076555",
    "B00076962",
    "B00077189",
    "B00077312",
    "B00077568",
    "B00077782",
    "B00078234",
    "B00078494",
    "B00078499",
    "B00078610",
    "B00078637",
    "B00078712",
    "B00079047",
    "B00079225",
    "B00079374",
    "B00079606",
    "B00079680",
    "B00079715",
    "B00080031",
    "B00080064",
    "B00080182",
    "B00081329",
    "B00081448",
    "B00081463",
    "B00081623",
    "B00081872",
    "B00081973",
    "B00082040",
    "B00082050",
    "B00082160",
    "B00082424",
    "B00082681",
    "B00082850",
    "B00083349",
    "B00083695",
    "B00083842",
    "B00083901",
    "B00084147",
    "B00084233",
    "B00084483",
    "B00084574",
    "B00084578",
    "B00084709",
    "B00085021",
    "B00085271",
    "B00085829",
    "B00085905",
    "B00086319",
    "B00087022",
    "B00088155",
    "B00088353",
    "B00088426",
    "B00088504",
    "B00089053",